1451,34597480,https://www.airbnb.com/rooms/34597480,20240917031253,2024-09-17,city scrape,Bright One-Bedroom on the Park,Large one-bedroom close to U Chicago campus. Vintage apartment with modern amenities facing the Midway and Jackson Park. Newly remodeled kitchen and bath with in-unit washer and dryer.,"Walk to uchicago campus, coffee shops, restaurants and bars.",https://a0.muscache.com/pictures/c41b6d00-11b4-4eac-8bab-df074a2903c6.jpg,23006345,https://www.airbnb.com/users/show/23006345,Madeline,2014-10-26,"Chicago, IL",,within a day,75%,29%,f,https://a0.muscache.com/im/users/23006345/profile_pic/1414375460/original.jpg?aki_policy=profile_small,https://a0.muscache.com/im/users/23006345/profile_pic/1414375460/original.jpg?aki_policy=profile_x_medium,Hyde Park,1,1,"['email', 'phone', 'work_email']",t,t,Neighborhood highlights,Hyde Park,,41.789,-87.58865,Entire rental unit,Entire home/apt,2,1.0,1 bath,1.0,1.0,"[""Bidet"", ""Refrigerator"", ""Self check-in"", ""Wifi"", ""Dishwasher"", ""Heating"", ""TV with Netflix, Roku, Amazon Prime Video, Hulu"", ""Free dryer \u2013 In unit"", ""Stove"", ""Garden view"", ""Record player"", ""Coffee"", ""Lake access"", ""Shampoo"", ""Ethernet connection"", ""Sound system"", ""Hangers"", ""Oven"", ""Wine glasses"", ""Private entrance"", ""Free parking on premises"", ""Bathtub"", ""Clothing storage"", ""Long term stays allowed"", ""Rice maker"", ""Hot water kettle"", ""Body soap"", ""Coffee maker"", ""Books and reading material"", ""Dishes and silverware"", ""Hair dryer"", ""Cleaning products"", ""Essentials"", ""Bed linens"", ""Fire extinguisher"", ""Free washer \u2013 In unit"", ""Drying rack for clothing"", ""Carbon monoxide alarm"", ""Dedicated workspace"", ""Toaster"", ""Extra pillows and blankets"", ""Free street parking"", ""Keypad"", ""Freezer"", ""Ceiling fan"", ""Kitchen"", ""Cooking basics"", ""Microwave"", ""Hot water""]",$250.00,32,1125,32,32,1125,1125,32.0,1125.0,,t,2,2,25,270,2024-09-17,12,0,0,2019-07-26,2023-05-27,4.92,4.92,4.92,5.0,5.0,4.83,4.5,R19000041362,f,1,1,0,0,0.19
1454,34649740,https://www.airbnb.com/rooms/34649740,20240917031253,2024-09-17,city scrape,Sparkling Clean and Sanitized Chicago Coach House,Stay our historic 1886 Chicago coach house nestled in Bridgeport's arts district.<br />It has been fully rehabbed with brand new finishes and appliances.  <br />Decorated in modern farmhouse design.  Well lit exterior and an inviting courtyard with charming festoon lights.,"Enjoy your stay in our rehabbed 1886 coach house and revel in the best of Bridgeport's history and culture mere steps away from your front door.<br /><br />You can check out our blog and Facebook page for more updated information on the neighborhood and Chicago.  www.chicagocoachhouse. com  https://www.facebook. com/ ChicagoCoachHouse <br /><br />Get a taste of the real Windy City in the home to five Chicago mayors--Bridgeport. <br /><br />Home of some of the best functioning representations of the Chicago worker cottage, the Chicago White Sox and the famed Zhou B art gallery, partake in Bridgeport's finest with the Morgan St. arts corridor and the Bridgeport Arts Center just steps away.  <br /><br />Start your day with a great cup of joe from Bridgeport Coffee or unwind with a local craft brew from Maria's after a day of sightseeing.  <br /><br />Great food options abound with Zaytune Mediterranean, the Polo Cafe, Nonna Soluri's Italian Sandwiches, Kimski's Polish/Korean, Antique Taco",https://a0.muscache.com/pictures/893e6643-b2b0-426e-b532-5cd268bb5518.jpg,261404932,https://www.airbnb.com/users/show/261404932,Emily,2019-05-12,"Chicago, IL","My husband and I love Chicago and especially enjoy sharing our appreciation of architecture,  great food and fun experiences with our guests.

And when we travel, our favorite part is meeting new people.   

Now that we have kids and travel less than we'd like,  being a host allows us the perfect opportunity to meet people from around the world.

Share your story with us!
",within a day,100%,,f,https://a0.muscache.com/im/pictures/user/9690b93c-311d-4e5f-a238-6ababc98acfe.jpg?aki_policy=profile_small,https://a0.muscache.com/im/pictures/user/9690b93c-311d-4e5f-a238-6ababc98acfe.jpg?aki_policy=profile_x_medium,Bridgeport,2,2,"['email', 'phone']",t,f,Neighborhood highlights,Bridgeport,,41.83326,-87.65196,Entire cottage,Entire home/apt,4,1.0,1 bath,2.0,3.0,"[""Shower gel"", ""Refrigerator"", ""First aid kit"", ""Backyard"", ""Self check-in"", ""Wifi"", ""Dishwasher"", ""Heating"", ""Dryer"", ""Stove"", ""Exterior security cameras on property"", ""Shampoo"", ""Sound system"", ""Hangers"", ""Oven"", ""Private entrance"", ""Free parking on premises"", ""Bathtub"", ""Children\u2019s dinnerware"", ""TV"", ""Air conditioning"", ""Long term stays allowed"", ""Children\u2019s books and toys"", ""Lockbox"", ""Pack \u2019n play/Travel crib"", ""High chair"", ""Washer"", ""Conditioner"", ""Hair dryer"", ""Essentials"", ""Bed linens"", ""Dishes and silverware"", ""Iron"", ""Fire extinguisher"", ""Luggage dropoff allowed"", ""Carbon monoxide alarm"", ""Dedicated workspace"", ""Smoke alarm"", ""Single level home"", ""Free street parking"", ""Board games"", ""Freezer"", ""Coffee maker: Keurig coffee machine, pour-over coffee"", ""Ceiling fan"", ""Kitchen"", ""Cooking basics"", ""Microwave"", ""Hot water""]",$79.00,30,1125,30,30,1125,1125,30.0,1125.0,,t,0,0,0,77,2024-09-17,68,0,0,2019-07-14,2021-05-31,4.84,4.84,4.9,4.97,4.99,4.85,4.84,R19000043822,f,2,2,0,0,1.08
1464,34809632,https://www.airbnb.com/rooms/34809632,20240917031253,2024-09-17,city scrape,Cozy Stay,"Located a few blocks from the University of Chicago and 1 mile west of Chicago's beautiful lakefront, this 1st floor Condo offers plenty of comfort and space.  Bedroom includes a firm Queen-size mattress and plenty of shared space.","One of Chicago's best coffee shops ""Greenline Coffee"" is only across the street. Washington Park one block away.  4 block from Chicago Metro Squash House. Neighboring Hyde Park is full of wonderful restaurants, shopping, and other entertainment (music, museums, theater). A stroll along the university campus or the lakefront always renews the spirit. The Museum of Science and Industry, beaches and the Jackson Park golf course are only a few blocks away!",https://a0.muscache.com/pictures/86481303/55bb0422_original.jpg,32200299,https://www.airbnb.com/users/show/32200299,Nate,2015-04-29,"Chicago, IL",,within a day,90%,86%,t,https://a0.muscache.com/im/users/32200299/profile_pic/1434343154/original.jpg?aki_policy=profile_small,https://a0.muscache.com/im/users/32200299/profile_pic/1434343154/original.jpg?aki_policy=profile_x_medium,Woodlawn,5,6,"['email', 'phone']",t,t,Neighborhood highlights,Woodlawn,,41.783544,-87.613592,Private room in condo,Private room,1,1.0,1 shared bath,1.0,1.0,"[""Refrigerator"", ""Bikes"", ""First aid kit"", ""Self check-in"", ""Wifi"", ""Dishwasher"", ""Heating"", ""Shared backyard \u2013 Fully fenced"", ""Dryer"", ""Stove"", ""Exterior security cameras on property"", ""Dining table"", ""Lock on bedroom door"", ""Shampoo"", ""Coffee"", ""Bread maker"", ""Hangers"", ""Oven"", ""Private entrance"", ""Free parking on premises"", ""Bathtub"", ""TV"", ""Air conditioning"", ""Private BBQ grill: charcoal"", ""Lockbox"", ""Washer"", ""Body soap"", ""Coffee maker"", ""Books and reading material"", ""Conditioner"", ""Hair dryer"", ""Cleaning products"", ""Essentials"", ""Bed linens"", ""Iron"", ""Fire extinguisher"", ""Dishes and silverware"", ""Barbecue utensils"", ""Ceiling fan"", ""Carbon monoxide alarm"", ""Dedicated workspace"", ""Toaster"", ""Smoke alarm"", ""Free street parking"", ""Freezer"", ""Baking sheet"", ""Portable fans"", ""Kitchen"", ""Cooking basics"", ""Microwave"", ""Hot water""]",$50.00,2,1125,2,2,1125,1125,2.0,1125.0,,t,9,37,67,341,2024-09-17,17,0,0,2019-05-22,2023-08-12,4.94,5.0,4.94,4.88,5.0,4.71,4.94,R17000015110,f,5,3,2,0,0.26
1468,34866762,https://www.airbnb.com/rooms/34866762,20240917031253,2024-09-17,city scrape,Comfy 2 Bedroom Apartment w/ Office,"Located a few blocks from the University of Chicago and 1 mile west of Chicago's beautiful lakefront, this 1st floor Condo offers plenty of comfort and space.  2 Bedrooms include firm Queen-size mattress and plenty of space.  Dedicated office space","One of Chicago's best coffee shops ""Greenline Coffee"" is only across the street. Washington Park one block away. 4 block from Chicago Metro Squash House. Neighboring Hyde Park is full of wonderful restaurants, shopping, and other entertainment (music, museums, theater). A stroll along the university campus or the lakefront always renews the spirit. The Museum of Science and Industry, beaches and the Jackson Park golf course are only a few blocks away!",https://a0.muscache.com/pictures/86481303/55bb0422_original.jpg,32200299,https://www.airbnb.com/users/show/32200299,Nate,2015-04-29,"Chicago, IL",,within a day,90%,86%,t,https://a0.muscache.com/im/users/32200299/profile_pic/1434343154/original.jpg?aki_policy=profile_small,https://a0.muscache.com/im/users/32200299/profile_pic/1434343154/original.jpg?aki_policy=profile_x_medium,Woodlawn,5,6,"['email', 'phone']",t,t,Neighborhood highlights,Woodlawn,,41.78406,-87.61273,Entire condo,Entire home/apt,4,1.0,1 bath,2.0,2.0,"[""Shower gel"", ""Refrigerator"", ""BBQ grill"", ""First aid kit"", ""Backyard"", ""Self check-in"", ""Wifi"", ""Dishwasher"", ""Heating"", ""Dryer"", ""Stove"", ""Exterior security cameras on property"", ""Dining table"", ""Coffee"", ""Shampoo"", ""Wine glasses"", ""Hangers"", ""Oven"", ""Free parking on premises"", ""Bathtub"", ""Clothing storage"", ""TV"", ""Air conditioning"", ""Lockbox"", ""Hot water kettle"", ""Washer"", ""Body soap"", ""Coffee maker"", ""Books and reading material"", ""Conditioner"", ""Hair dryer"", ""Cleaning products"", ""Essentials"", ""Bed linens"", ""Iron"", ""Fire extinguisher"", ""Dishes and silverware"", ""Drying rack for clothing"", ""Barbecue utensils"", ""Carbon monoxide alarm"", ""Dedicated workspace"", ""Toaster"", ""Smoke alarm"", ""Extra pillows and blankets"", ""Free street parking"", ""Freezer"", ""Baking sheet"", ""Ceiling fan"", ""Kitchen"", ""Cooking basics"", ""Microwave"", ""Hot water""]",$115.00,2,90,2,2,90,90,2.0,90.0,,t,0,26,56,331,2024-09-17,68,30,2,2022-08-08,2024-08-26,4.99,4.99,4.99,5.0,5.0,4.63,4.94,R17000015110,f,5,3,2,0,2.64
1469,34866772,https://www.airbnb.com/rooms/34866772,20240917031253,2024-09-17,city scrape,Comfy Stay,"Located a few blocks from the University of Chicago and 1 mile west of Chicago's beautiful lakefront, this 1st floor Condo offers plenty of comfort and space.  Bedroom includes a firm Queen-size mattress and plenty of shared space.","One of Chicago's best coffee shops ""Greenline Coffee"" is only across the street. Washington Park one block away.  4 block from Chicago Metro Squash House. Neighboring Hyde Park is full of wonderful restaurants, shopping, and other entertainment (music, museums, theater). A stroll along the university campus or the lakefront always renews the spirit. The Museum of Science and Industry, beaches and the Jackson Park golf course are only a few blocks away!",https://a0.muscache.com/pictures/86481303/55bb0422_original.jpg,32200299,https://www.airbnb.com/users/show/32200299,Nate,2015-04-29,"Chicago, IL",,within a day,90%,86%,t,https://a0.muscache.com/im/users/32200299/profile_pic/1434343154/original.jpg?aki_policy=profile_small,https://a0.muscache.com/im/users/32200299/profile_pic/1434343154/original.jpg?aki_policy=profile_x_medium,Woodlawn,5,6,"['email', 'phone']",t,t,Neighborhood highlights,Woodlawn,,41.78417,-87.61256,Private room in condo,Private room,1,1.0,1 shared bath,1.0,1.0,"[""First aid kit"", ""Self check-in"", ""Wifi"", ""Heating"", ""Dryer"", ""Exterior security cameras on property"", ""Lock on bedroom door"", ""Shampoo"", ""Hangers"", ""Private entrance"", ""Free parking on premises"", ""Bathtub"", ""Lockbox"", ""Central air conditioning"", ""Washer"", ""Hair dryer"", ""Essentials"", ""Iron"", ""Fire extinguisher"", ""Dedicated workspace"", ""Carbon monoxide alarm"", ""Smoke alarm"", ""HDTV with Amazon Prime Video, Chromecast, Hulu, Netflix, Roku"", ""Kitchen"", ""Breakfast""]",$57.00,2,90,2,2,90,90,2.0,90.0,,t,4,33,63,152,2024-09-17,8,1,0,2022-06-05,2024-05-18,5.0,5.0,5.0,5.0,5.0,4.75,5.0,R17000015110,f,5,3,2,0,0.29
1629,37752023,https://www.airbnb.com/rooms/37752023,20240917031253,2024-09-17,city scrape,Spacious smart apartment with theater & jacuzzi.,"Welcome to spacious, top floor, freshly painted apartment in Old Irving Park neighborhood. Enjoy 1300 square ft. (~120 sq. m.) space with granite countertops, Apple TV home theater, in-unit washer and dryer, whole apartment sound system, jacuzzi, and dimmer lighting. Control lightning and music via smart phone or assistant. 5 minutes walk to the CTA Blue line, close proximity to major Chicago highways.",Proximity to Blue line (use Addison stop - the walk is so much nicer) ensures that you will be at the terminal  within 30 minutes - it's 20 minutes train ride - this is why we got this place in the first place. If you drive you can be downtown within 15 minutes. (I use Barteau Ave to get to I-90 west and Kimball for eastbound). Right downstairs there is lovey coffeeshop  and pretty awesome restaurant Hearth & Crust .<br />If you like parks Horner Park (Irving Park / California) is just awesome - try walk right on the river!. We have other 2 parks within walking distance the are also amazing and pet friendly.,https://a0.muscache.com/pictures/miso/Hosting-37752023/original/c46348c2-7c1e-4a7f-853d-58e8174dc636.jpeg,25764937,https://www.airbnb.com/users/show/25764937,Andre,2015-01-07,"Chicago, IL",I am techy guy who likes to repair things. I enjoy good music and awesome company.,within a day,100%,100%,t,https://a0.muscache.com/im/pictures/user/User-25764937/original/f7651a0b-ed1c-435a-8625-d0d0b5ea6a03.jpeg?aki_policy=profile_small,https://a0.muscache.com/im/pictures/user/User-25764937/original/f7651a0b-ed1c-435a-8625-d0d0b5ea6a03.jpeg?aki_policy=profile_x_medium,Irving Park,1,1,"['email', 'phone']",t,t,Neighborhood highlights,Irving Park,,41.95533,-87.71745,Entire condo,Entire home/apt,6,1.0,1 bath,2.0,2.0,"[""Shower gel"", ""Refrigerator"", ""BBQ grill"", ""First aid kit"", ""Shared gym in building"", ""Self check-in"", ""Dishwasher"", ""Pets allowed"", ""Heating"", ""Free dryer \u2013 In unit"", ""Shared backyard \u2013 Fully fenced"", ""Fast wifi \u2013 192 Mbps"", ""Smart lock"", ""Babysitter recommendations"", ""Record player"", ""Dining table"", ""Coffee"", ""Shampoo"", ""Ethernet connection"", ""Exercise equipment: free weights, yoga mat"", ""Sound system"", ""Hangers"", ""Wine glasses"", ""Coffee maker: drip coffee maker, espresso machine"", ""Room-darkening shades"", ""Outdoor furniture"", ""Long term stays allowed"", ""Central air conditioning"", ""50 inch HDTV with Amazon Prime Video, Apple TV, Netflix"", ""Hot water kettle"", ""Paid parking garage on premises \u2013 1 space"", ""Body soap"", ""Mosquito net"", ""Books and reading material"", ""Conditioner"", ""Hair dryer"", ""Cleaning products"", ""Essentials"", ""Bed linens"", ""Iron"", ""Fire extinguisher"", ""Free washer \u2013 In unit"", ""Dishes and silverware"", ""City skyline view"", ""Private hot tub"", ""Frigidaire stainless steel single oven"", ""Carbon monoxide alarm"", ""Dedicated workspace"", ""Shared patio or balcony"", ""Smoke alarm"", ""Extra pillows and blankets"", ""Frigidaire stainless steel gas stove"", ""Free street parking"", ""Blender"", ""Board games"", ""Clothing storage: closet and dresser"", ""Freezer"", ""Ceiling fan"", ""Kitchen"", ""Cooking basics"", ""Microwave"", ""Hot water""]",$95.00,32,365,32,32,1125,1125,32.0,1125.0,,t,0,0,16,91,2024-09-17,18,5,1,2019-08-28,2024-09-01,5.0,5.0,4.89,5.0,4.94,4.83,4.94,R19000044951,f,1,1,0,0,0.29
1732,39341910,https://www.airbnb.com/rooms/39341910,20240917031253,2024-09-17,city scrape,Dorothy's Place ll(Quick Access to Downtown),"This beautifully decorated multi-unit property consist of 6 bedrooms, 2 bathrooms, 2 kitchens and can slept 12.  If you would like to book the entire space, please let the host know.  Located on a quiet tree-lined street, with well manicured landscaping we are 5 minutes from the I290 Expressway, a 15 minute drive into downtown Chicago, Soldier Field, McCormick Place, Lakefront, walking distance to public transportation and 10 minute drive to grocery stores, restaurants & so much more.",,https://a0.muscache.com/pictures/7dff04e0-1dfb-4dba-b540-f9fdd2d180b2.jpg,185579695,https://www.airbnb.com/users/show/185579695,LaToya,2018-04-21,"Chicago, IL","LaToya started Dorothy's Place in honor of her late mother Dorothy Moore, whom was known for her cleanliness, hospitality and sense of humor.  She treated and made everyone feel like family.  Those are just two of many of LaToya's goals for all those entering Dorothy's Place.  Besides being the founder of Dorothy's Place, LaToya is also a licensed Illinois Realtor.  When she's not working, she loves to travel, spend time with her family and friends and mentor youth in her community.  She was born and raised in the very same community that Dorothy's Place is located.  She prides herself on giving back, helping and making others laugh.  Her motto is simple ""Live, Laugh & Love"".  Most importantly be nice to everyone.  You never know when God has placed you in the presence of angel.",within a day,75%,100%,f,https://a0.muscache.com/im/pictures/user/User-185579695/original/524054d3-9c19-4d08-9ebe-a2b2640b6a15.jpeg?aki_policy=profile_small,https://a0.muscache.com/im/pictures/user/User-185579695/original/524054d3-9c19-4d08-9ebe-a2b2640b6a15.jpeg?aki_policy=profile_x_medium,Austin,2,2,"['email', 'phone']",t,t,,Austin,,41.87395,-87.75385,Entire rental unit,Entire home/apt,5,1.0,1 bath,3.0,3.0,"[""Refrigerator"", ""First aid kit"", ""Backyard"", ""Self check-in"", ""Wifi"", ""Dishwasher"", ""Heating"", ""Stove"", ""Exterior security cameras on property"", ""Shampoo"", ""Hangers"", ""Oven"", ""Private entrance"", ""Free parking on premises"", ""TV"", ""Air conditioning"", ""Long term stays allowed"", ""Coffee maker"", ""Dishes and silverware"", ""Hair dryer"", ""Essentials"", ""Iron"", ""Fire extinguisher"", ""Dedicated workspace"", ""Carbon monoxide alarm"", ""Smoke alarm"", ""Keypad"", ""Kitchen"", ""Cooking basics"", ""Microwave"", ""Hot water""]",$228.00,32,1125,32,32,1125,1125,32.0,1125.0,,t,0,0,0,164,2024-09-17,43,1,0,2020-09-06,2023-10-09,4.86,4.93,4.84,4.93,4.93,4.63,4.88,R20000053258,f,2,2,0,0,0.88
1766,39773921,https://www.airbnb.com/rooms/39773921,20240917031253,2024-09-17,city scrape,LAKEVIEW 2 BEDROOM NEXT TO WHOLE FOODS + OFFICE,"WiFi Speed 235 Mbps. Office Desk & Office Chair, Extra Office room. Modern 2 bedrooms apartment in the heart of Lakeview. TV w/Amazon Fire Stick. Full stuck kitchen, towels, bedding.  The backyard features a bbq and patio table&chairs. Walk to everything! Whole Foods, Southport Corridor, Wrigley, tons of restaurants, shopping, entertainment, and services. Great access to CTA Red/Brown/Purple line trains, and Buses. 1.5 miles to the lakefront. 8min walk to the train station. 2nd-floor apartment.","Lakeview<br />Share this post:<br />Why we love it<br />Lakeview’s laidback atmosphere and picture-perfect shoreline make it a favorite hang out among locals. And spots like lively Wrigleyville and the Belmont Theater District make it a major entertainment hub, too.<br /><br />Insider tips<br />Anchored by a beautiful stretch of shoreline to the east, Lakeview melds several distinct areas — East Lakeview, Central Lakeview, Boystown, and Wrigleyville. Each spot has its own unique character, but they’re all pulled together by Lakeview’s casual, welcoming feel.<br /><br />Hit the bustling shopping districts along Broadway in East Lakeview, along Belmont near Boystown, and the bustling Southport Corridor for local boutiques, record shops, and vintage treasure hunting. Or live it up with the locals at the seemingly endless array of bars and pubs, and the dozens of much-loved neighborhood restaurants that lie in between.<br /><br />Lakeview is also known as a go-to for arts and culture — you",https://a0.muscache.com/pictures/d4f5312e-c2a2-4525-aafa-f0a173c3befd.jpg,49626033,https://www.airbnb.com/users/show/49626033,Roma,2015-11-22,"Chicago, IL","interior designer, love art  and love to travel on my days off!
",within a day,60%,27%,f,https://a0.muscache.com/im/pictures/user/48e5cd86-a030-4206-8195-5c81daba3354.jpg?aki_policy=profile_small,https://a0.muscache.com/im/pictures/user/48e5cd86-a030-4206-8195-5c81daba3354.jpg?aki_policy=profile_x_medium,River North,13,74,"['email', 'phone']",t,f,Neighborhood highlights,Lake View,,41.93916,-87.66643,Entire rental unit,Entire home/apt,3,1.0,1 bath,2.0,2.0,"[""Shower gel"", ""Refrigerator"", ""BBQ grill"", ""First aid kit"", ""Wifi"", ""Dishwasher"", ""Heating"", ""Stove"", ""Exterior security cameras on property"", ""Dining table"", ""Shampoo"", ""Wine glasses"", ""Hangers"", ""Oven"", ""Private entrance"", ""Patio or balcony"", ""Outdoor furniture"", ""Central air conditioning"", ""Long term stays allowed"", ""Pack \u2019n play/Travel crib"", ""Free washer \u2013 In building"", ""Mosquito net"", ""Coffee maker"", ""Paid parking lot off premises"", ""Dishes and silverware"", ""Hair dryer"", ""Cleaning products"", ""Free dryer \u2013 In building"", ""Essentials"", ""Bed linens"", ""Iron"", ""Fire extinguisher"", ""Carbon monoxide alarm"", ""Dedicated workspace"", ""Clothing storage: walk-in closet, closet, and dresser"", ""Toaster"", ""Smoke alarm"", ""HDTV with Amazon Prime Video, Netflix"", ""Indoor fireplace"", ""Freezer"", ""Shared backyard \u2013 Fully fenced"", ""Kitchen"", ""Cooking basics"", ""Microwave"", ""Hot water""]",$120.00,32,1125,32,32,1125,1125,32.0,1125.0,,t,30,60,90,365,2024-09-17,1,0,0,2020-03-31,2020-03-31,5.0,5.0,5.0,5.0,5.0,5.0,5.0,,f,12,12,0,0,0.02
1767,39774697,https://www.airbnb.com/rooms/39774697,20240917031253,2024-09-17,city scrape,LAKEVIEW 1 BEDROOM UNIT WIFI - NEXT TO WHOLE FOODS,"Private Laundry in the unit. Big Apartment in the heart of Lakeview, TV Wifi Netflix. All kitchen essentials, towels, bedding. Backyard features outdoor furniture and BBQ. Walk to everything! Whole Foods 2min walk, Southport Corridor, Wrigley, tons of restaurants, shopping, entertainment etc. Great access to CTA Red/Brown/Purple line trains, and Buses. 3rd floor unit. (Please note Shower high 5.8 feet) Induction Electric Cooktop. 4-Slice Toaster Oven. No stove.","Lakeview<br />Share this post:<br />Why we love it<br />Lakeview’s laidback atmosphere and picture-perfect shoreline make it a favorite hang out among locals. And spots like lively Wrigleyville and the Belmont Theater District make it a major entertainment hub, too.<br /><br />Insider tips<br />Anchored by a beautiful stretch of shoreline to the east, Lakeview melds several distinct areas — East Lakeview, Central Lakeview, Boystown, and Wrigleyville. Each spot has its own unique character, but they’re all pulled together by Lakeview’s casual, welcoming feel.<br /><br />Hit the bustling shopping districts along Broadway in East Lakeview, along Belmont near Boystown, and the bustling Southport Corridor for local boutiques, record shops, and vintage treasure hunting. Or live it up with the locals at the seemingly endless array of bars and pubs, and the dozens of much-loved neighborhood restaurants that lie in between.<br /><br />Lakeview is also known as a go-to for arts and culture — you",https://a0.muscache.com/pictures/ae3183e3-147f-42b9-b7e5-06108cca120b.jpg,49626033,https://www.airbnb.com/users/show/49626033,Roma,2015-11-22,"Chicago, IL","interior designer, love art  and love to travel on my days off!
",within a day,60%,27%,f,https://a0.muscache.com/im/pictures/user/48e5cd86-a030-4206-8195-5c81daba3354.jpg?aki_policy=profile_small,https://a0.muscache.com/im/pictures/user/48e5cd86-a030-4206-8195-5c81daba3354.jpg?aki_policy=profile_x_medium,River North,13,74,"['email', 'phone']",t,f,Neighborhood highlights,Lake View,,41.94062,-87.66475,Entire rental unit,Entire home/apt,2,1.0,1 bath,1.0,1.0,"[""Shower gel"", ""Refrigerator"", ""BBQ grill"", ""First aid kit"", ""Backyard"", ""Wifi"", ""Heating"", ""Free dryer \u2013 In unit"", ""Exterior security cameras on property"", ""Shampoo"", ""Hangers"", ""Private entrance"", ""Bathtub"", ""Patio or balcony"", ""Air conditioning"", ""Outdoor furniture"", ""Long term stays allowed"", ""Outdoor dining area"", ""Body soap"", ""Mosquito net"", ""Coffee maker"", ""Paid parking lot off premises"", ""Dishes and silverware"", ""Hair dryer"", ""Cleaning products"", ""Essentials"", ""Bed linens"", ""Iron"", ""Free washer \u2013 In unit"", ""Drying rack for clothing"", ""Carbon monoxide alarm"", ""Smoke alarm"", ""Extra pillows and blankets"", ""Indoor fireplace"", ""Freezer"", ""Kitchen"", ""Cooking basics"", ""TV with standard cable, Amazon Prime Video, Netflix"", ""Microwave"", ""Hot water""]",$110.00,360,1125,360,360,1125,1125,360.0,1125.0,,t,30,60,90,365,2024-09-17,5,0,0,2019-12-01,2022-12-04,4.6,5.0,5.0,5.0,4.8,5.0,4.2,City registration pending,f,12,12,0,0,0.09
