5124,871907172181842739,https://www.airbnb.com/rooms/871907172181842739,20240917031253,2024-09-17,city scrape,Oak Park Living,"Upon entering the condo, you'll be greeted by a warm and inviting ambiance. The living area features tasteful decor, plush seating, and large windows that bathe the space in natural light. Unwind on the comfortable sofa, catch up on your favorite shows, or simply enjoy a good book in the cozy atmosphere. <br /><br />Easy access to attractions, restaurants, shops, and cultural landmarks. Whether you're a art lover, foodie, or simply seeking a relaxing getaway, this location has something for everyone.","Oak Park is renowned for its rich architectural history, as it is home to numerous Frank Lloyd Wright-designed buildings. Take a stroll through the charming tree-lined streets, visit the Frank Lloyd Wright Home and Studio, or explore the nearby Oak Park Conservatory for a tranquil escape.<br /><br />If you're in the mood for culinary delights, Oak Park offers a diverse range of restaurants, cafes, and bars. Indulge in local specialties, international cuisine, or grab a quick bite at one of the many charming eateries in the area.<br /><br />Public transportation is easily accessible, allowing you to venture into downtown Chicago and explore the city's iconic landmarks, such as Millennium Park, Navy Pier, the Art Institute of Chicago, and more.",https://a0.muscache.com/pictures/miso/Hosting-871907172181842739/original/89016877-56b6-4938-acbb-4cd20a0355b1.jpeg,510545457,https://www.airbnb.com/users/show/510545457,Lineage,2023-04-17,,,within a day,83%,100%,t,https://a0.muscache.com/im/pictures/user/6524fd9e-5d7f-490e-97f2-67b260f409a4.jpg?aki_policy=profile_small,https://a0.muscache.com/im/pictures/user/6524fd9e-5d7f-490e-97f2-67b260f409a4.jpg?aki_policy=profile_x_medium,Austin,1,1,"['email', 'phone']",t,t,Neighborhood highlights,Austin,,41.89336697663143,-87.77290134228149,Entire rental unit,Entire home/apt,4,2.0,2 baths,2.0,2.0,"[""Refrigerator"", ""Stainless steel oven"", ""Self check-in"", ""Wifi"", ""Dishwasher"", ""Pets allowed"", ""Central heating"", ""Free dryer \u2013 In unit"", ""Exterior security cameras on property"", ""Dining table"", ""Shampoo"", ""Hangers"", ""Bathtub"", ""Lockbox"", ""Long term stays allowed"", ""Body soap"", ""Coffee maker"", ""Conditioner"", ""Bed linens"", ""Cleaning products"", ""Essentials"", ""Dishes and silverware"", ""Iron"", ""Free washer \u2013 In unit"", ""65 inch HDTV"", ""Carbon monoxide alarm"", ""Toaster"", ""Smoke alarm"", ""Gas stove"", ""Single level home"", ""Free street parking"", ""Clothing storage: closet and dresser"", ""Freezer"", ""Ceiling fan"", ""Kitchen"", ""Cooking basics"", ""Microwave"", ""Hot water""]",$118.00,32,365,32,32,1125,1125,32.0,1125.0,,t,0,0,0,140,2024-09-17,1,0,0,2023-07-31,2023-07-31,5.0,5.0,5.0,5.0,5.0,5.0,5.0,,f,1,1,0,0,0.07
5166,879035468285610750,https://www.airbnb.com/rooms/879035468285610750,20240917031253,2024-09-17,city scrape,Spacious Studio Garden Unit,"Welcome to our modern and spacious garden unit studio apartment! This stylish retreat offers everything you need for a comfortable stay. Relax in the cozy bed or unwind on the comfy couch while watching your favorite shows on the flat-screen TV. The layout provides plenty of lounging space, perfect for enjoying a morning coffee or reading a book. Whether you're here for business or leisure, our studio is the perfect home away from home. Book your stay now and experience comfort and convenience!",,https://a0.muscache.com/pictures/hosting/Hosting-879035468285610750/original/3a5760ec-a2a4-49d5-938f-25f282f2b31c.jpeg,214293137,https://www.airbnb.com/users/show/214293137,Langston,2018-09-08,"Chicago, IL",,within a day,83%,83%,f,https://a0.muscache.com/im/pictures/user/2d8021b4-9484-4a42-84d8-a52bcc34b5e8.jpg?aki_policy=profile_small,https://a0.muscache.com/im/pictures/user/2d8021b4-9484-4a42-84d8-a52bcc34b5e8.jpg?aki_policy=profile_x_medium,Austin,1,1,"['email', 'phone']",t,t,,Austin,,41.91027393145752,-87.77357366697055,Entire rental unit,Entire home/apt,2,1.0,1 bath,1.0,1.0,"[""Refrigerator"", ""Self check-in"", ""Wifi"", ""Stove"", ""Exterior security cameras on property"", ""Coffee"", ""Free parking on premises"", ""TV"", ""Lockbox"", ""Coffee maker"", ""Dishes and silverware"", ""Sun loungers"", ""Barbecue utensils"", ""Carbon monoxide alarm"", ""Dedicated workspace"", ""Freezer"", ""Kitchen"", ""Cooking basics"", ""Microwave""]",$95.00,1,5,2,2,5,5,2.0,5.0,,t,1,1,20,20,2024-09-17,2,2,2,2024-09-03,2024-09-08,5.0,5.0,5.0,5.0,5.0,4.5,5.0,R24000119945,f,1,1,0,0,2.0
5187,882186352794962538,https://www.airbnb.com/rooms/882186352794962538,20240917031253,2024-09-17,city scrape,"2-Bed, 2-Bath, Brand New apt. Super Clean!","Apt is brand new construction, stylish and modern decor, comfortable new beds, beautiful bathrooms, washer and dryer,  kitchenette, table and chairs, small sofa, Wi-Fi, coffee and tea included.  Located in West Rogers Park neighborhood of Chicago, close to the suburbs of Skokie and Evanston, local shopping and public transportation.",,https://a0.muscache.com/pictures/miso/Hosting-882186352794962538/original/05b1a38e-ee85-43cb-a51c-00541757add5.jpeg,349206204,https://www.airbnb.com/users/show/349206204,Sholom,2020-06-08,"Chicago, IL",,within a day,90%,68%,f,https://a0.muscache.com/im/pictures/user/330a80b5-2e60-4c27-9632-5903f5a89b7e.jpg?aki_policy=profile_small,https://a0.muscache.com/im/pictures/user/330a80b5-2e60-4c27-9632-5903f5a89b7e.jpg?aki_policy=profile_x_medium,West Ridge,1,2,"['email', 'phone']",t,f,,West Ridge,,42.00357,-87.69858,Entire rental unit,Entire home/apt,6,2.0,2 baths,2.0,5.0,"[""Refrigerator"", ""Outlet covers"", ""First aid kit"", ""Radiant heating"", ""Self check-in"", ""Wifi"", ""Dove or Pantene conditioner"", ""Free dryer \u2013 In unit"", ""Exterior security cameras on property"", ""Smart lock"", ""AC - split type ductless system"", ""Dining table"", ""Coffee"", ""Pack \u2019n play/Travel crib - always at the listing"", ""Heating - split type ductless system"", ""Hangers"", ""Private entrance"", ""Free parking on premises"", ""Bathtub"", ""Children\u2019s books and toys"", ""High chair"", ""Books and reading material"", ""Dishes and silverware"", ""Hair dryer"", ""Cleaning products"", ""Essentials"", ""Bed linens"", ""Iron"", ""Fire extinguisher"", ""Free washer \u2013 In unit"", ""Mini fridge"", ""Clothing storage: wardrobe"", ""Dove or Pantene shampoo"", ""Carbon monoxide alarm"", ""Dedicated workspace"", ""Coffee maker: Keurig coffee machine"", ""Smoke alarm"", ""Extra pillows and blankets"", ""Free street parking"", ""Safe"", ""Board games"", ""Dove or Pantene body soap"", ""Kitchen"", ""Microwave"", ""Hot water""]",$171.00,2,28,2,2,28,28,2.0,28.0,,t,16,46,76,166,2024-09-17,39,24,1,2023-07-02,2024-08-18,4.67,4.67,4.87,4.82,4.72,4.69,4.56,R23000103011,f,1,1,0,0,2.64
5200,882791943988944661,https://www.airbnb.com/rooms/882791943988944661,20240917031253,2024-09-17,city scrape,Beautiful Bedroom in Modern Home on Quiet Street,My name is Ebony and my husband's name is Ean. We live in Woodlawn with our cat named Ciathe. We have  decided to open up our space to make people coming to this area feel at home. We live in a modern home that we try to make comfortable for guest. It has a fair amount of space and is close to the University of Chicago and public transit on the Greenline.,Woodlawn is a neighborhood surrounded by the University of Chicago that has very invested neighbors and a lot of development happening.,https://a0.muscache.com/pictures/miso/Hosting-882791943988944661/original/847b5283-d39f-4e3d-a4d4-8d3d0dfacfcd.jpeg,2672672,https://www.airbnb.com/users/show/2672672,Ebony,2012-06-18,"Chicago, IL","Brooklyn native now taking in all the south side of Chicago has to offer. Excited to host guests. I love talking, about African American culture, music and Chicago real estate. I also love brewing coffee…",within a day,100%,67%,t,https://a0.muscache.com/im/pictures/user/e9586d0f-02ab-4362-8575-9f31da7ca6d1.jpg?aki_policy=profile_small,https://a0.muscache.com/im/pictures/user/e9586d0f-02ab-4362-8575-9f31da7ca6d1.jpg?aki_policy=profile_x_medium,Woodlawn,3,7,"['email', 'phone']",t,t,Neighborhood highlights,Woodlawn,,41.78235131796151,-87.60769325578515,Private room in home,Private room,2,1.0,1 private bath,1.0,1.0,"[""Lock on bedroom door"", ""Smoke alarm"", ""First aid kit"", ""Free parking on premises"", ""Hair dryer"", ""Self check-in"", ""Wifi"", ""Keypad"", ""Iron"", ""TV"", ""Air conditioning"", ""Fire extinguisher"", ""Exercise equipment"", ""Exterior security cameras on property"", ""Kitchen"", ""Carbon monoxide alarm"", ""Washer""]",$73.00,1,1125,2,2,1125,1125,2.0,1125.0,,t,0,12,41,130,2024-09-17,13,13,0,2023-09-24,2024-07-07,5.0,5.0,5.0,5.0,5.0,4.85,5.0,R23000108645,f,3,0,3,0,1.08
5308,897214973251082026,https://www.airbnb.com/rooms/897214973251082026,20240917031253,2024-09-17,city scrape,Artsy Boystown Gem,"This unique place has a style of its own and is literally in the middle of everything. Walking distance to Whole Foods, Wrigley Stadium, the lakefront and many restaurants and bars around.<br /><br />My place is located on the main strip here in Boystown and above a popular bar here.","Middle of Boystown. Safe and convenient location. Walking distance to Whole Foods, Wrigley Stadium and many restaurants and bars.",https://a0.muscache.com/pictures/hosting/Hosting-U3RheVN1cHBseUxpc3Rpbmc6ODk3MjE0OTczMjUxMDgyMDI2/original/53bb9749-3899-4d52-95b9-140b23d96a7c.jpeg,261421704,https://www.airbnb.com/users/show/261421704,Randi,2019-05-12,"North Chicago, IL",,within a day,60%,67%,f,https://a0.muscache.com/im/pictures/user/0af3fd00-0ca5-44da-9025-b6526e15dca5.jpg?aki_policy=profile_small,https://a0.muscache.com/im/pictures/user/0af3fd00-0ca5-44da-9025-b6526e15dca5.jpg?aki_policy=profile_x_medium,Lake View East,1,3,['phone'],t,f,Neighborhood highlights,Lake View,,41.949248,-87.65034059999999,Private room in rental unit,Private room,2,1.0,1 bath,1.0,1.0,"[""First aid kit"", ""Wifi"", ""Beach access \u2013 Beachfront"", ""Heating"", ""Exterior security cameras on property"", ""Lake access"", ""Shampoo"", ""TV"", ""Body soap"", ""Conditioner"", ""Bed linens"", ""Essentials"", ""Cleaning products"", ""Dishes and silverware"", ""Dedicated workspace"", ""Carbon monoxide alarm"", ""Smoke alarm"", ""Safe"", ""Host greets you"", ""Kitchen"", ""Cooking basics""]",$150.00,1,365,2,2,365,365,2.0,365.0,,t,17,47,77,352,2024-09-17,9,6,0,2023-06-11,2024-08-12,5.0,4.89,4.89,5.0,5.0,5.0,4.89,R23000102740,f,1,0,1,0,0.58
5382,906706795051864773,https://www.airbnb.com/rooms/906706795051864773,20240917031253,2024-09-17,city scrape,Humboldt Homestead,"This stylish place to stay is perfect for your Chicago getaway. You’ll have access to a living area, kitchen, and two additional rooms - one with an office set up and another with a bed and couch. Close to the bus line and multiple restaurants to enjoy. Come check out our cozy garden unit! Separate entrance and your own space to relax and unwind.",,https://a0.muscache.com/pictures/miso/Hosting-906706795051864773/original/72f1aed8-f042-4285-8ecd-61821f6a2bcd.jpeg,32509108,https://www.airbnb.com/users/show/32509108,Rachel,2015-05-03,"Omaha, NE",,within a day,100%,64%,f,https://a0.muscache.com/im/pictures/user/2c8636eb-39f0-4a0a-bee6-1c381a7c65ea.jpg?aki_policy=profile_small,https://a0.muscache.com/im/pictures/user/2c8636eb-39f0-4a0a-bee6-1c381a7c65ea.jpg?aki_policy=profile_x_medium,Humboldt Park,1,4,"['email', 'phone']",t,t,,Humboldt Park,,41.911758498994885,-87.71648238602765,Entire rental unit,Entire home/apt,5,1.0,1 bath,1.0,1.0,"[""Shower gel"", ""Refrigerator"", ""Backyard"", ""Self check-in"", ""Wifi"", ""Pets allowed"", ""Heating"", ""Exterior security cameras on property"", ""Dining table"", ""Coffee"", ""Shampoo"", ""Shared BBQ grill: gas"", ""Private entrance"", ""Free parking on premises"", ""TV"", ""Air conditioning"", ""Outdoor furniture"", ""Long term stays allowed"", ""Coffee maker"", ""Conditioner"", ""Dishes and silverware"", ""Essentials"", ""Laundromat nearby"", ""Dedicated workspace"", ""Carbon monoxide alarm"", ""Toaster"", ""Smoke alarm"", ""Free street parking"", ""Keypad"", ""Freezer"", ""Kitchen"", ""Cooking basics"", ""Microwave"", ""Hot water""]",$70.00,32,1125,32,32,1125,1125,32.0,1125.0,,t,0,0,11,286,2024-09-17,2,1,0,2023-08-13,2023-12-05,5.0,4.5,5.0,5.0,5.0,5.0,4.5,,f,1,1,0,0,0.15
5387,907159283163297665,https://www.airbnb.com/rooms/907159283163297665,20240917031253,2024-09-17,city scrape,Stunning 3 Bedroom Old Town Condo,"Get ready to enjoy all that Chicago has to offer while staying at our exquisite duplexed condo in the heart of Old Town.  Located steps from Lincoln Park Zoo, this stunning accommodation offers a wealth of amenities while serving as the perfect base camp for conveniently accessing the Lake Michigan, nightlife, museums, etc.","Located on the North Side of Chicago, Old Town is a historic neighborhood that offers a unique blend of charm, cultural attractions, and a vibrant atmosphere. With its tree-lined streets and well-preserved architecture, Old Town transports visitors back in time while offering modern amenities and entertainment options.<br /><br />One of the distinctive features of Old Town is its architectural heritage. Walking through the neighborhood, visitors can admire a stunning selection of highly desirable Victorian residences from the 1880s, along with a couple of Art Deco gems. <br /><br />In addition to its architectural and religious attractions, Old Town boasts a lively entertainment scene. The famous Second City comedy club, located in the heart of Old Town, has nurtured some of the world's greatest comedic talents, including Tina Fey and Bill Murray. Visitors can catch a hilarious improv show or enjoy a night of laughter at this iconic venue.",https://a0.muscache.com/pictures/miso/Hosting-907159283163297665/original/162893bc-75d4-4b5a-9e95-9508e8322fb9.jpeg,114914409,https://www.airbnb.com/users/show/114914409,James,2017-02-05,"Chicago, IL",We love to travel and it makes the trip more enjoyable when we find lodging that enhances the overall experience.  We manage our properties ourselves and try to make sure that the amenities and cleanliness of the home meet the standards that we would expect if we were guests.,within a day,100%,63%,f,https://a0.muscache.com/im/pictures/user/7d294256-24d9-479d-940e-6df90f520486.jpg?aki_policy=profile_small,https://a0.muscache.com/im/pictures/user/7d294256-24d9-479d-940e-6df90f520486.jpg?aki_policy=profile_x_medium,Old Town Triangle,1,2,"['email', 'phone']",t,t,Neighborhood highlights,Lincoln Park,,41.91602,-87.635896,Entire home,Entire home/apt,6,3.0,3 baths,3.0,3.0,"[""Shower gel"", ""First aid kit"", ""Radiant heating"", ""Self check-in"", ""Wifi"", ""Dishwasher"", ""48 inch HDTV with Apple TV, Disney+, HBO Max, Hulu, Netflix, Roku"", ""Free dryer \u2013 In unit"", ""Pack \u2019n play/Travel crib - available upon request"", ""Dining table"", ""Shampoo"", ""Wine glasses"", ""Hangers"", ""Bathtub"", ""Room-darkening shades"", ""Air conditioning"", ""High chair"", ""Body soap"", ""KitchenAid refrigerator"", ""Dishes and silverware"", ""Hair dryer"", ""Cleaning products"", ""Essentials"", ""Bed linens"", ""Iron"", ""Fire extinguisher"", ""Free washer \u2013 In unit"", ""Drying rack for clothing"", ""Carbon monoxide alarm"", ""Dedicated workspace"", ""Toaster"", ""Coffee maker: Keurig coffee machine"", ""Shared patio or balcony"", ""Fisher&Paykel stainless steel double oven"", ""Smoke alarm"", ""Gas stove"", ""Free street parking"", ""Keypad"", ""Board games"", ""Clothing storage: closet and dresser"", ""Freezer"", ""Ceiling fan"", ""Kitchen"", ""Cooking basics"", ""Indoor fireplace: gas"", ""Microwave"", ""Hot water""]",$375.00,6,31,6,6,31,31,6.0,31.0,,t,3,33,46,313,2024-09-17,8,6,0,2023-07-19,2024-08-16,5.0,5.0,4.88,5.0,5.0,5.0,4.75,R23000103538,f,1,1,0,0,0.56
5388,907264543028348019,https://www.airbnb.com/rooms/907264543028348019,20240917031253,2024-09-17,city scrape,This is the best bedroom for you !,"The neighborhood is very quiet, the home have security cameras around the building, very safe., ring bell on the door",,https://a0.muscache.com/pictures/hosting/Hosting-U3RheVN1cHBseUxpc3Rpbmc6OTA3MjY0NTQzMDI4MzQ4MDE5/original/d046ac75-f417-45c0-be62-4eb82eb28d57.jpeg,518375463,https://www.airbnb.com/users/show/518375463,Jacqueline,2023-06-05,,,within a day,60%,55%,f,https://a0.muscache.com/defaults/user_pic-50x50.png?v=3,https://a0.muscache.com/defaults/user_pic-225x225.png?v=3,Schorsch Village,2,2,"['email', 'phone']",f,t,,Dunning,,41.9449,-87.78532,Private room in rental unit,Private room,1,1.0,1 shared bath,1.0,1.0,"[""65 inch HDTV with Fire TV, DVD player"", ""First aid kit"", ""Self check-in"", ""Wifi"", ""Central heating"", ""Dryer"", ""Exterior security cameras on property"", ""Free parking on premises"", ""Air conditioning"", ""Paid washer \u2013 In building"", ""Dishes and silverware"", ""Hair dryer"", ""Fire extinguisher"", ""Carbon monoxide alarm"", ""Smoke alarm"", ""Keypad"", ""Ceiling fan"", ""Kitchen"", ""Hot water""]",$30.00,1,365,2,2,365,365,2.0,365.0,,t,1,30,60,239,2024-09-17,3,2,0,2023-08-20,2024-05-05,5.0,5.0,5.0,5.0,5.0,5.0,5.0,R23000105508,f,2,1,1,0,0.23
5508,924140192659774581,https://www.airbnb.com/rooms/924140192659774581,20240917031253,2024-09-17,city scrape,Wicker Park Hideaway,"Enjoy a stay in this cozy one bedroom in the heart of Chicago's Wicker Park neighborhood! Minutes to Damen Blue Line train, Metra train, highway and shops/ dining/nightlife all in walking distance. Parks, grocery stores and running trail also all within blocks. <br /><br />The apartment is complete with everything you need to cook, relax, and explore the city.","In the heart of Chicago's trendy Wicker Park neighborhood, walk to amazing restaurants, boutiques and bars. Easy access to getting to all of the great sights and attractions the city has to offer by car, bus, train or on foot.",https://a0.muscache.com/pictures/miso/Hosting-46985157/original/6d787f13-29e4-45af-a4ab-2aa0a60dab9d.jpeg,1115629,https://www.airbnb.com/users/show/1115629,T,2011-09-06,"Chicago, IL",,within a day,100%,50%,f,https://a0.muscache.com/im/pictures/user/User-1115629/original/76e65953-cd4e-4f91-bcba-669455882f4b.jpeg?aki_policy=profile_small,https://a0.muscache.com/im/pictures/user/User-1115629/original/76e65953-cd4e-4f91-bcba-669455882f4b.jpeg?aki_policy=profile_x_medium,West Town,1,2,"['email', 'phone']",t,t,Neighborhood highlights,West Town,,41.91320395363213,-87.67110380061989,Entire rental unit,Entire home/apt,3,1.0,1 bath,1.0,1.0,"[""Refrigerator"", ""BBQ grill"", ""First aid kit"", ""Wifi"", ""Heating"", ""Dryer"", ""Shampoo"", ""Hangers"", ""Private entrance"", ""Free parking on premises"", ""TV"", ""Outdoor dining area"", ""Body soap"", ""Washer"", ""Books and reading material"", ""Dishes and silverware"", ""Bed linens"", ""Cleaning products"", ""Essentials"", ""Iron"", ""Fire extinguisher"", ""Carbon monoxide alarm"", ""Piano"", ""Dedicated workspace"", ""Smoke alarm"", ""Free street parking"", ""Ceiling fan"", ""Kitchen"", ""Cooking basics"", ""Hot water""]",$115.00,1,365,2,2,365,365,2.0,365.0,,t,0,2,2,2,2024-09-17,5,3,0,2023-08-06,2024-06-22,4.8,4.8,4.2,4.8,5.0,4.8,4.4,R23000104259,f,1,1,0,0,0.37
5540,929232712729258238,https://www.airbnb.com/rooms/929232712729258238,20240917031253,2024-09-17,city scrape,Charming Furnished 2 BR / 1 BA !,"* Lovely Hardwood Floors: Furnished 2 bedroom / 1 bath <br />* Whole Top Unit :  Chicago South Side 2nd floor walkup of a 2-flat  <br />* Each bedroom has Queen Bed, storage,  closet<br />* Wi-Fi  * Central A/C * In-Unit W & D <br />* All Utilities Included! <br />* Pets require current rabies / health records<br />* Access  Xpressway # 94/ Interstate # 57/ Toll Road # 90<br />* Near Hospitals: Advocate Trinity, Jackson Park, South Shore, U of C Med. Center<br />* Chicago State University/ University of Chicago/ Olive-Harvey College",,https://a0.muscache.com/pictures/miso/Hosting-929232712729258238/original/04cc49b6-f9f7-4942-a50b-3fa021620c9e.jpeg,519821532,https://www.airbnb.com/users/show/519821532,Bernie,2023-06-13,"Chicago, IL",I  taught Polka Line Dancing at a Charity Event !,within a day,100%,100%,f,https://a0.muscache.com/im/pictures/user/User-519821532/original/1084b500-569f-42b1-ad97-b143dd728d3a.jpeg?aki_policy=profile_small,https://a0.muscache.com/im/pictures/user/User-519821532/original/1084b500-569f-42b1-ad97-b143dd728d3a.jpeg?aki_policy=profile_x_medium,South Side,1,1,"['email', 'phone']",t,t,,Chatham,,41.7313516,-87.60658749999999,Entire rental unit,Entire home/apt,4,1.0,1 bath,2.0,2.0,"[""Refrigerator"", ""First aid kit"", ""Stainless steel oven"", ""Self check-in"", ""Wifi"", ""Pets allowed"", ""Central heating"", ""Free dryer \u2013 In unit"", ""Shared backyard \u2013 Fully fenced"", ""Exterior security cameras on property"", ""Dining table"", ""Coffee"", ""Shampoo"", ""Shared beach access"", ""Hangers"", ""Private entrance"", ""Free parking on premises"", ""Bathtub"", ""TV"", ""Air conditioning"", ""Long term stays allowed"", ""Lockbox"", ""Coffee maker: drip coffee maker"", ""Stainless steel gas stove"", ""Conditioner"", ""Hair dryer"", ""Cleaning products"", ""Essentials"", ""Bed linens"", ""Iron"", ""Fire extinguisher"", ""Free washer \u2013 In unit"", ""Dishes and silverware"", ""Carbon monoxide alarm"", ""Dedicated workspace"", ""Clothing storage: walk-in closet, closet, and dresser"", ""Smoke alarm"", ""Extra pillows and blankets"", ""Free street parking"", ""Blender"", ""Ceiling fan"", ""Kitchen"", ""Cooking basics"", ""Microwave"", ""Hot water""]",$79.00,32,180,32,32,1125,1125,32.0,1125.0,,t,0,0,0,70,2024-09-17,2,2,0,2023-10-28,2024-02-03,5.0,5.0,5.0,5.0,5.0,4.5,5.0,,f,1,1,0,0,0.18
5543,929757275013057995,https://www.airbnb.com/rooms/929757275013057995,20240917031253,2024-09-17,city scrape,Modern and Luxurious apartment in the West Town,"Welcome to our stunning listing in the heart of West Town! <br />This fully equipped and beautifully designed property is sure to exceed your expectations. Being 1 mile away from the United Center Arena means you'll have easy access to thrilling sports events, concerts, and entertainment.<br />The vibrant neighborhood of West Town offers fantastic dining options, trendy boutiques, and lively bars. You'll be able to explore all that Chicago has to offer!<br />Book now and experience the luxury of our West Town.",,https://a0.muscache.com/pictures/miso/Hosting-929757275013057995/original/46f9ce17-62ac-442f-919b-1f63eeec8728.jpeg,524126503,https://www.airbnb.com/users/show/524126503,Maciej,2023-07-06,,,within a day,100%,38%,t,https://a0.muscache.com/defaults/user_pic-50x50.png?v=3,https://a0.muscache.com/defaults/user_pic-225x225.png?v=3,West Town,1,1,"['email', 'phone']",f,t,,West Town,,41.89595725032399,-87.67843703914797,Entire rental unit,Entire home/apt,8,2.0,2 baths,3.0,4.0,"[""Shower gel"", ""BBQ grill"", ""First aid kit"", ""Children's playroom"", ""Wifi"", ""Dishwasher"", ""Central heating"", ""Free dryer \u2013 In unit"", ""Dining table"", ""Shampoo"", ""Wine glasses"", ""Hangers"", ""Private patio or balcony"", ""Bathtub"", ""Outdoor furniture"", ""Air conditioning"", ""Long term stays allowed"", ""75 inch HDTV with Amazon Prime Video"", ""Clothing storage: closet"", ""Hot water kettle"", ""Outdoor dining area"", ""Washer"", ""Body soap"", ""GE refrigerator"", ""Books and reading material"", ""Conditioner"", ""Bed linens"", ""Cleaning products"", ""Essentials"", ""Dishes and silverware"", ""Fire extinguisher"", ""Carbon monoxide alarm"", ""Dedicated workspace"", ""Toaster"", ""Free driveway parking on premises \u2013 1 space"", ""Smoke alarm"", ""Gas stove"", ""Extra pillows and blankets"", ""Blender"", ""Freezer"", ""Ge stainless steel single oven"", ""Kitchen"", ""Cooking basics"", ""Microwave"", ""Hot water""]",$224.00,3,365,3,3,365,365,3.0,365.0,,t,0,0,0,74,2024-09-17,12,8,0,2023-07-30,2024-05-27,5.0,5.0,5.0,4.92,4.92,5.0,4.92,R23000104855,f,1,1,0,0,0.87
