3358,572478943867267168,https://www.airbnb.com/rooms/572478943867267168,20240917031253,2024-09-17,city scrape,Mayfair / North Park University / Albany Park,"Nice size 1 bedroom with queen size bed, bd/room Fits two ppl comfortably. Access to the Back balcony Area, living room, dining area, washer/dryer, modern kitchen & guests have their own private bathroom. The condo is only 5 mins to North Park University, short trip to Lincoln Square restaurants/bars, few blocks to Blue line public transportation, 4.5 miles to the lake. The Brown Line train is right down the street, the 81 CTA bus will take you right to the Brown train. More (?) DM me first.","Peaceful area of Chicago, IL., Off the 90/94 highways, only 15-25 mins from O'Hare Airport via Car or Train, Close to City Downtown Loop Chicago 15-25 mins or so, a short trip in either direction, Safe neighborhood., Great local places to get food and shop while here something within walking distance.",https://a0.muscache.com/pictures/9fd19fcb-4c18-40d3-9c3a-cfb6dd7cfcfd.jpg,447270257,https://www.airbnb.com/users/show/447270257,Darren,2022-02-28,"Chicago, IL","I am a very happy go lucky type of guy, who is always positive and looks for the best in others, nothing gets to me, and I see the best in almost everything I do. I consider myself to be funny at times but do have a serious side to me when it comes to my work life. I'm here looking for ppl to share/rent out my home and enjoy staying here for a month or longer. ",within a day,75%,0%,f,https://a0.muscache.com/im/pictures/user/4218bfa4-0add-4fa1-a668-465874c9be18.jpg?aki_policy=profile_small,https://a0.muscache.com/im/pictures/user/4218bfa4-0add-4fa1-a668-465874c9be18.jpg?aki_policy=profile_x_medium,Irving Park,2,2,"['email', 'phone', 'work_email']",t,f,Neighborhood highlights,Irving Park,,41.968033,-87.742508,Private room in condo,Private room,2,1.0,1 private bath,1.0,1.0,"[""BBQ grill"", ""First aid kit"", ""Stainless steel oven"", ""Dishwasher"", ""Central heating"", ""Free dryer \u2013 In unit"", ""Babysitter recommendations"", ""Clothing storage: walk-in closet and closet"", ""Lock on bedroom door"", ""Ethernet connection"", ""Dining table"", ""Wine glasses"", ""Hangers"", ""Free parking on premises"", ""Bathtub"", ""Outdoor furniture"", ""Long term stays allowed"", ""Central air conditioning"", ""Paid parking lot on premises \u2013 1 space"", ""Rice maker"", ""Hot water kettle"", ""Outdoor dining area"", ""Shared space, you will have a few shelves to store your food/drinks. refrigerator"", ""Fast wifi \u2013 112 Mbps"", ""Dishes and silverware"", ""Hair dryer"", ""Essentials"", ""Bed linens"", ""Baby safety gates"", ""Fire extinguisher"", ""Laundromat nearby"", ""Free washer \u2013 In unit"", ""Drying rack for clothing"", ""Luggage dropoff allowed"", ""Barbecue utensils"", ""Ceiling fan"", ""Carbon monoxide alarm"", ""Dedicated workspace"", ""Toaster"", ""Shared patio or balcony"", ""Smoke alarm"", ""Extra pillows and blankets"", ""Free street parking"", ""Blender"", ""Host greets you"", ""Freezer"", ""Baking sheet"", ""Coffee maker: french press"", ""Portable fans"", ""Kitchen"", ""Cooking basics"", ""Indoor fireplace: gas"", ""I only ask that you clean up afterwards. Don\u2019t leave a mess after using stove or oven.  stainless steel gas stove"", ""Microwave"", ""Hot water""]",$75.00,32,365,32,32,365,365,32.0,365.0,,t,30,32,32,32,2024-09-17,0,0,0,,,,,,,,,,,f,2,0,2,0,
3383,579265550163905456,https://www.airbnb.com/rooms/579265550163905456,20240917031253,2024-09-17,city scrape,The Cornell | South Shore 3BR Condo |  Sleeps 8,"All stays include a complimentary Uber giftcard! <br /><br />Welcome to The Cornell, a newly designed art gallery experience.  The Cornell was designed to capture the heart and soul of Chicago's South Shore with original artwork and timeless pieces. <br /><br />Explore the artworks of The Cornell's wide-ranging collection from local artists.<br /><br />- 10 min away from Hyde Park<br />- 20 min away from Downtown<br />- Sleeps up to 12 guests (1 king bed, 1 queen bed, 2 twin beds, 1 queen air mattress)","The community benefits from its location along the waterfront, its accessibility to Lake Shore Drive, and its proximity to major institutions and attractions such as the University of Chicago, the Museum of Science and Industry, and Jackson Park.",https://a0.muscache.com/pictures/81684bcb-4095-4590-b150-29bdc4bd7cf9.jpg,122823566,https://www.airbnb.com/users/show/122823566,Frantz,2017-03-27,"Evanston, IL",,within a day,100%,88%,t,https://a0.muscache.com/im/pictures/user/b6656d8f-2233-462c-8685-7965b12a441b.jpg?aki_policy=profile_small,https://a0.muscache.com/im/pictures/user/b6656d8f-2233-462c-8685-7965b12a441b.jpg?aki_policy=profile_x_medium,South Shore,1,2,['phone'],t,t,Neighborhood highlights,South Shore,,41.75335,-87.58399,Entire rental unit,Entire home/apt,8,1.0,1 bath,3.0,4.0,"[""Shower gel"", ""Refrigerator"", ""First aid kit"", ""Stainless steel oven"", ""Self check-in"", ""Wifi"", ""Central heating"", ""Free dryer \u2013 In unit"", ""Exterior security cameras on property"", ""Shampoo"", ""Wine glasses"", ""Hangers"", ""Free parking on premises"", ""TV"", ""Air conditioning"", ""Long term stays allowed"", ""Lockbox"", ""Washer"", ""Conditioner"", ""Hair dryer"", ""Cleaning products"", ""Essentials"", ""Dishes and silverware"", ""Iron"", ""Fire extinguisher"", ""Carbon monoxide alarm"", ""Dedicated workspace"", ""Smoke alarm"", ""Gas stove"", ""Free street parking"", ""Kitchen"", ""Cooking basics"", ""Clothing storage: walk-in closet and closet"", ""Hot water""]",$129.00,2,365,2,2,365,365,2.0,365.0,,t,8,29,59,327,2024-09-17,48,24,3,2022-04-03,2024-09-02,4.73,4.77,4.83,4.94,4.9,4.4,4.75,R23000100562,f,1,1,0,0,1.6
3385,579606258906138547,https://www.airbnb.com/rooms/579606258906138547,20240917031253,2024-09-17,city scrape,Lovely 2 bedroom apartment in Portage park.,"Keep it simple at this peaceful and centrally-located place near downtown and ohare airport in Portage park location. This renovated but still original, 2 bedroom apartment is close to Chicago's Hottest and Hippest neighborhoods (Wicker Park/Bucktown/logan square) with everything you need or want within a short walk - Transportation(Blue Line Train) or drive.","Our location is a is family friendly  neighborhood called PortagePark, near fine dining restaurants, and shopping centers.",https://a0.muscache.com/pictures/c9e6ea7e-2871-4640-aea6-d3df9efa6949.jpg,448924033,https://www.airbnb.com/users/show/448924033,Flerida,2022-03-10,"Chicago, IL",,within a day,100%,92%,t,https://a0.muscache.com/im/pictures/user/40362172-a8ae-45a1-94d7-0fa74ecfa918.jpg?aki_policy=profile_small,https://a0.muscache.com/im/pictures/user/40362172-a8ae-45a1-94d7-0fa74ecfa918.jpg?aki_policy=profile_x_medium,Portage Park,1,1,['phone'],t,t,Neighborhood highlights,Portage Park,,41.95127,-87.75155,Entire rental unit,Entire home/apt,4,1.0,1 bath,2.0,2.0,"[""Refrigerator"", ""First aid kit"", ""Stainless steel oven"", ""Radiant heating"", ""Self check-in"", ""Wifi"", ""Exterior security cameras on property"", ""Dining table"", ""Coffee"", ""Ethernet connection"", ""Hangers"", ""Free parking on premises"", ""Bathtub"", ""Room-darkening shades"", ""TV"", ""Long term stays allowed"", ""Clothing storage: closet"", ""Coffee maker: drip coffee maker"", ""Stainless steel gas stove"", ""Dishes and silverware"", ""Hair dryer"", ""Essentials"", ""Cleaning products"", ""Bed linens"", ""Iron"", ""Fire extinguisher"", ""Luggage dropoff allowed"", ""Carbon monoxide alarm"", ""Dedicated workspace"", ""Window AC unit"", ""Smoke alarm"", ""Extra pillows and blankets"", ""Free street parking"", ""Keypad"", ""Freezer"", ""Kitchen"", ""Cooking basics"", ""Microwave"", ""Hot water""]",$135.00,1,1125,2,2,1125,1125,2.0,1125.0,,t,18,48,78,353,2024-09-17,37,11,0,2022-05-01,2024-08-05,4.81,4.78,4.92,4.95,4.95,4.76,4.76,R23000102300,f,1,1,0,0,1.27
3393,580496627944996421,https://www.airbnb.com/rooms/580496627944996421,20240917031253,2024-09-17,city scrape,"Sleek, comfortable 2 bed/2bath in Ukranian Village","FULLY FURNISHED ~ <br /><br />Sleek, comfortable 2 bed/2bath apartment is available for rent from September 15th for 1.5 months. The unit has in-unit washer and dryer, dishwasher, fireplace and is situated in Ukrainian village. The second bedroom is set up as office with monitors, office chair and comfy sleeper sofa. <br />Dark matter coffee shop and grocery store are located next door in addition to abundant choices of restaurants and places of interest such as gyms, yoga studios, art galleries, spas, CVS.",Ukranian Village,https://a0.muscache.com/pictures/44b883e5-e9d8-4ffe-9a1e-df6e39a75f22.jpg,50222850,https://www.airbnb.com/users/show/50222850,Tanya,2015-11-30,"Chicago, IL",,within a day,100%,100%,f,https://a0.muscache.com/im/pictures/user/17fb7b41-c286-4a73-b7d7-8efd823c94e2.jpg?aki_policy=profile_small,https://a0.muscache.com/im/pictures/user/17fb7b41-c286-4a73-b7d7-8efd823c94e2.jpg?aki_policy=profile_x_medium,West Town,1,2,"['email', 'phone']",t,t,Neighborhood highlights,West Town,,41.89587,-87.68621,Entire condo,Entire home/apt,4,2.0,2 baths,2.0,2.0,"[""BBQ grill"", ""Wifi"", ""Dishwasher"", ""Free dryer \u2013 In unit"", ""Fire pit"", ""Wine glasses"", ""Hangers"", ""Free parking on premises"", ""Bathtub"", ""TV"", ""Patio or balcony"", ""Central air conditioning"", ""Outdoor furniture"", ""Long term stays allowed"", ""Outdoor dining area"", ""Washer"", ""Dishes and silverware"", ""Bed linens"", ""Iron"", ""Mini fridge"", ""Dedicated workspace"", ""Carbon monoxide alarm"", ""Coffee maker: french press, Nespresso"", ""Toaster"", ""Smoke alarm"", ""Bosch stainless steel gas stove"", ""Extra pillows and blankets"", ""Free street parking"", ""Indoor fireplace"", ""Blender"", ""Bosch refrigerator"", ""Freezer"", ""Kitchen"", ""Cooking basics"", ""Stainless steel single oven"", ""Microwave""]",$95.00,32,44,32,32,44,44,32.0,44.0,,t,27,51,51,51,2024-09-17,0,0,0,,,,,,,,,,,f,1,1,0,0,
3438,590579464403439607,https://www.airbnb.com/rooms/590579464403439607,20240917031253,2024-09-17,city scrape,The Wilson Club,"Kick back and relax in this calm, stylish space.",Atmosphere and features of the community is to die for! It’s a growing community. Truman college is cross street. Your local markets are walking distance and the beach is a five min walk!,https://a0.muscache.com/pictures/8a86895f-44a7-468b-b7a5-693c2fd16f42.jpg,451250349,https://www.airbnb.com/users/show/451250349,Jquail,2022-03-25,,,within a day,100%,,f,https://a0.muscache.com/im/pictures/user/43bd8d1b-5ead-4c62-8377-95333e2f3b9d.jpg?aki_policy=profile_small,https://a0.muscache.com/im/pictures/user/43bd8d1b-5ead-4c62-8377-95333e2f3b9d.jpg?aki_policy=profile_x_medium,Uptown,1,1,"['email', 'phone']",t,t,Neighborhood highlights,Uptown,,41.96589,-87.65756,Entire rental unit,Entire home/apt,2,1.0,1 bath,0.0,1.0,"[""Refrigerator"", ""BBQ grill"", ""Stainless steel oven"", ""Shared gym in building"", ""Wifi"", ""Dishwasher"", ""Pets allowed"", ""Central heating"", ""Exercise equipment"", ""Exterior security cameras on property"", ""Dining table"", ""Lake access"", ""Cleaning available during stay"", ""Wine glasses"", ""Hangers"", ""Private entrance"", ""Room-darkening shades"", ""Long term stays allowed"", ""Central air conditioning"", ""Pool table"", ""Elevator"", ""65 inch HDTV with Amazon Prime Video, Disney+, Apple TV, HBO Max, Hulu, Netflix"", ""Dishes and silverware"", ""Hair dryer"", ""Cleaning products"", ""Essentials"", ""Iron"", ""Fire extinguisher"", ""Free washer \u2013 In unit"", ""City skyline view"", ""Luggage dropoff allowed"", ""Waterfront"", ""Carbon monoxide alarm"", ""Dedicated workspace"", ""Outdoor shower"", ""Shared patio or balcony"", ""Smoke alarm"", ""Trash compactor"", ""Free street parking"", ""Stainless steel stove"", ""Clothing storage: closet and dresser"", ""Host greets you"", ""Baking sheet"", ""Shared beach access"", ""Kitchen"", ""Cooking basics"", ""Microwave""]",$200.00,32,1125,32,32,1125,1125,32.0,1125.0,,t,30,60,90,180,2024-09-17,0,0,0,,,,,,,,,,,f,1,1,0,0,
3491,599542221242810329,https://www.airbnb.com/rooms/599542221242810329,20240917031253,2024-09-17,city scrape,Junction Grove Inn -Spacious Boutique Two Bedroom,"Welcome to the Function Grove Inn!<br /><br />This spacious, newly renovated two bedroom is  situated in a quiet residential area- just two blocks from the 94/Dan Ryan Expressway and ten minutes from downtown and the  Loop. Unit features unique art, designer furniture and functional home amenities.  Extra large bathroom has imported, black marble walls.  Extra large kitchen comfortable seats up to six people.<br /><br />Laundry room in unit.<br /><br />Roku Tv's:  kitchen, Livingroom and bedrooms. Security Camera in lobby.",Quiet residential block<br /><br />Yale-Harvard Community,https://a0.muscache.com/pictures/miso/Hosting-599542221242810329/original/639dd687-56cf-43f9-885b-06743797d60b.jpeg,256888705,https://www.airbnb.com/users/show/256888705,Jennipher,2019-04-19,"Chicago, IL",,within a day,67%,57%,f,https://a0.muscache.com/im/pictures/user/26fce4a8-20f3-4729-96c6-988a57e1d6e1.jpg?aki_policy=profile_small,https://a0.muscache.com/im/pictures/user/26fce4a8-20f3-4729-96c6-988a57e1d6e1.jpg?aki_policy=profile_x_medium,Englewood,2,4,"['email', 'phone']",t,t,Neighborhood highlights,Englewood,,41.77335,-87.63179,Entire serviced apartment,Entire home/apt,4,1.0,1 bath,2.0,2.0,"[""Refrigerator"", ""Smoke alarm"", ""First aid kit"", ""Coffee maker"", ""Free parking on premises"", ""Portable air conditioning"", ""Wifi"", ""Outdoor dining area"", ""Heating"", ""Outdoor furniture"", ""Dedicated workspace"", ""Dryer"", ""Exterior security cameras on property"", ""Kitchen"", ""50 inch HDTV with Roku"", ""Carbon monoxide alarm"", ""Washer""]",$100.00,32,365,32,32,365,365,32.0,365.0,,t,0,0,16,116,2024-09-17,2,0,0,2022-05-22,2022-05-30,4.5,4.5,4.0,5.0,5.0,4.0,4.5,R21000060738,f,2,2,0,0,0.07
3523,607073235389704428,https://www.airbnb.com/rooms/607073235389704428,20240917031253,2024-09-17,city scrape,Your south loop getaway..,"Be a guest in this spacious South Loop condo.  We're walking distance from Illinois Tech, McCormick Place, WinTrust Arena,  the Arie Crown Theater, Guaranteed Rate and Solider Field.  Motor Row.  Fresh towels and sheets are provided as well as complimentary coffee and water by us. The condo is adjacent to the green line train which provides  subtle noise until the early evening.",,https://a0.muscache.com/pictures/miso/Hosting-607073235389704428/original/56bd9bc4-0b34-4207-9dda-c2d01f27e422.jpeg,11310621,https://www.airbnb.com/users/show/11310621,Shawn,2014-01-14,"Chicago, IL","I'm based in Chicago and travel frequently for work, school and personal reasons. I also live on premises full time.",within a day,100%,100%,f,https://a0.muscache.com/im/pictures/user/fca1404b-e42c-494e-b3bb-faf6fd8a00e0.jpg?aki_policy=profile_small,https://a0.muscache.com/im/pictures/user/fca1404b-e42c-494e-b3bb-faf6fd8a00e0.jpg?aki_policy=profile_x_medium,Douglas,1,2,"['email', 'phone']",t,t,,Douglas,,41.84447444536118,-87.6248793780434,Private room in condo,Private room,2,1.0,1 private bath,1.0,1.0,"[""First aid kit"", ""Wifi"", ""Dishwasher"", ""Central heating"", ""Noise decibel monitors on property"", ""Free dryer \u2013 In unit"", ""Coffee"", ""Hangers"", ""Oven"", ""TV"", ""Air conditioning"", ""Long term stays allowed"", ""Clothing storage: closet"", ""Washer"", ""Smoking allowed"", ""Books and reading material"", ""Dishes and silverware"", ""Bed linens"", ""Cleaning products"", ""Iron"", ""Fire extinguisher"", ""Carbon monoxide alarm"", ""Smoke alarm"", ""Freezer"", ""Kitchen"", ""Cooking basics"", ""Microwave"", ""Hot water""]",$40.00,32,60,32,32,1125,1125,32.0,1125.0,,t,0,19,49,324,2024-09-17,0,0,0,,,,,,,,,,,f,1,0,1,0,
3546,611089980772836204,https://www.airbnb.com/rooms/611089980772836204,20240917031253,2024-09-17,city scrape,Art Inspired Two Bedroom Apartment,"Kick back and relax in this stylish space.  Each bedroom has a work space, personal microwave and a Roku TV.  The fully stocked  kitchen is ready for the true foodie to test it out.  Read or book or  enjoy a cup of coffee or tea in the inspiration room",,https://a0.muscache.com/pictures/miso/Hosting-611089980772836204/original/983787e8-9aff-4222-9d38-40a8b31c5148.jpeg,256888705,https://www.airbnb.com/users/show/256888705,Jennipher,2019-04-19,"Chicago, IL",,within a day,67%,57%,f,https://a0.muscache.com/im/pictures/user/26fce4a8-20f3-4729-96c6-988a57e1d6e1.jpg?aki_policy=profile_small,https://a0.muscache.com/im/pictures/user/26fce4a8-20f3-4729-96c6-988a57e1d6e1.jpg?aki_policy=profile_x_medium,Englewood,2,4,"['email', 'phone']",t,t,,Englewood,,41.77321182342138,-87.63258888530932,Entire serviced apartment,Entire home/apt,3,1.0,1 bath,2.0,2.0,"[""First aid kit"", ""Stainless steel oven"", ""Self check-in"", ""Wifi"", ""Central heating"", ""Exterior security cameras on property"", ""Dining table"", ""Coffee"", ""Wine glasses"", ""Hangers"", ""Whirlpool  refrigerator"", ""Private entrance"", ""Bathtub"", ""Room-darkening shades"", ""Outdoor furniture"", ""Long term stays allowed"", ""Lockbox"", ""Coffee maker: drip coffee maker, french press"", ""Varies shampoo"", ""Free washer \u2013 In building"", ""Hot water kettle"", ""Varies conditioner"", ""Stainless steel gas stove"", ""Books and reading material"", ""Dishes and silverware"", ""Hair dryer"", ""Cleaning products"", ""Free dryer \u2013 In building"", ""Essentials"", ""Bed linens"", ""Portable air conditioning"", ""Drying rack for clothing"", ""Carbon monoxide alarm"", ""Dedicated workspace"", ""Toaster"", ""Smoke alarm"", ""Extra pillows and blankets"", ""Free street parking"", ""Private backyard \u2013 Fully fenced"", ""Board games"", ""Dove  body soap"", ""Freezer"", ""Baking sheet"", ""Ceiling fan"", ""Kitchen"", ""Cooking basics"", ""50 inch HDTV with Roku"", ""Microwave"", ""Hot water""]",$117.00,32,365,32,32,365,365,32.0,365.0,,t,22,52,82,357,2024-09-17,1,0,0,2022-07-17,2022-07-17,5.0,5.0,5.0,5.0,5.0,3.0,5.0,R21000060738,f,2,2,0,0,0.04
3570,616168662512528578,https://www.airbnb.com/rooms/616168662512528578,20240917031253,2024-09-17,city scrape,3BD Home Mins from Airport | Free Wi-Fi + Parking,"Cozy home near O'Hare airport with a huge park just behind the backyard, located in one of the safest neighborhoods in the City of Chicago.  Quick access to the expressway and short walk to the CTA Blue Line train/bus station.<br /><br />Conveniently located within 5 miles of:<br />- O'Hare Airport<br />- Rosemont/Donald E. Stephens Convention Center <br />- All-State Arena<br />- Fashion Outlets of Chicago","Situated just south of Bryn Mawr Avenue and west of Harlem Avenue on the northwest side of the city, Oriole Park covers 19.51 acres of land. Outdoor amenities include two senior and four junior-sized baseball fields, one softball field and one combination soccer/football fields. In addition to two renovated playgrounds, a sandbox and an awesome interactive spray pool, the park features three tennis courts, two regular and one junior basketball standard and a paved path for walking, running, biking or inline skating.",https://a0.muscache.com/pictures/miso/Hosting-616168662512528578/original/4ced6037-9ced-4f8b-ae11-5e79bd9b7ae2.jpeg,131692581,https://www.airbnb.com/users/show/131692581,Karna,2017-05-23,"Chicago, IL","Grew up in Massachusetts, spent my 20's in Los Angeles, now living in Illinois where I am a Chicago Firefighter. ",within a day,80%,97%,t,https://a0.muscache.com/im/pictures/user/c07f1128-f5f7-4128-8e7e-de7097239e65.jpg?aki_policy=profile_small,https://a0.muscache.com/im/pictures/user/c07f1128-f5f7-4128-8e7e-de7097239e65.jpg?aki_policy=profile_x_medium,Oriole Park,1,1,"['email', 'phone']",t,t,Neighborhood highlights,Norwood Park,,41.98027,-87.81545,Entire home,Entire home/apt,6,1.0,1 bath,3.0,4.0,"[""Shower gel"", ""Refrigerator"", ""First aid kit"", ""Self check-in"", ""Wifi"", ""Heating"", ""Free dryer \u2013 In unit"", ""Exterior security cameras on property"", ""Smart lock"", ""Pack \u2019n play/Travel crib - available upon request"", ""Dining table"", ""Shampoo"", ""Wine glasses"", ""Hangers"", ""Oven"", ""Private entrance"", ""Private patio or balcony"", ""Free parking on premises"", ""Bathtub"", ""HDTV with Fire TV"", ""Room-darkening shades"", ""Outdoor furniture"", ""Central air conditioning"", ""Hot water kettle"", ""Outdoor dining area"", ""Body soap"", ""Conditioner"", ""Hair dryer"", ""Essentials"", ""Bed linens"", ""Dishes and silverware"", ""Iron"", ""Fire extinguisher"", ""Free washer \u2013 In unit"", ""Luggage dropoff allowed"", ""Coffee maker: drip coffee maker, Keurig coffee machine"", ""Carbon monoxide alarm"", ""Dedicated workspace"", ""Toaster"", ""Smoke alarm"", ""Gas stove"", ""Extra pillows and blankets"", ""Private backyard \u2013 Fully fenced"", ""Clothing storage: closet and dresser"", ""Freezer"", ""Baking sheet"", ""Kitchen"", ""Cooking basics"", ""Microwave"", ""Hot water""]",$159.00,2,28,2,2,1125,1125,2.0,1125.0,,t,10,11,33,118,2024-09-17,101,43,2,2022-07-04,2024-09-03,4.97,4.97,4.92,4.98,4.97,4.95,4.92,R22000083750,f,1,1,0,0,3.75
3579,617188250362684979,https://www.airbnb.com/rooms/617188250362684979,20240917031253,2024-09-17,city scrape,"Fun & Spacious 4BD/2BA | Pool Table, Arcade, Games","Welcome to The Clubhouse!  <br /><br />Enjoy a very spacious 4 bedroom/2 bath apartment in a great location! Whether you are planning to work, eat, drink, play, or just relax, you'll have easy access to everything from this centrally located home with easy access to the interstate & FREE street parking! <br /><br />Want to have a night in? You'll have plenty of options to keep you entertained - play billiards, board and card games, a head-to-head arcade, and more! <br /><br />There's never a dull moment in The Clubhouse!",,https://a0.muscache.com/pictures/miso/Hosting-617188250362684979/original/b65a6d78-cc03-475b-875b-bdfcc08d9482.jpeg,32940245,https://www.airbnb.com/users/show/32940245,Ron,2015-05-09,,,within a day,67%,80%,t,https://a0.muscache.com/im/users/32940245/profile_pic/1431147348/original.jpg?aki_policy=profile_small,https://a0.muscache.com/im/users/32940245/profile_pic/1431147348/original.jpg?aki_policy=profile_x_medium,Bucktown,1,1,"['email', 'phone']",t,t,,Logan Square,,41.92038,-87.67787,Entire condo,Entire home/apt,8,2.0,2 baths,4.0,4.0,"[""Refrigerator"", ""First aid kit"", ""Stainless steel oven"", ""Self check-in"", ""Dishwasher"", ""Central heating"", ""Free dryer \u2013 In unit"", ""Arcade games"", ""Exterior security cameras on property"", ""Fast wifi \u2013 270 Mbps"", ""Smart lock"", ""Dining table"", ""Cleaning available during stay"", ""Hangers"", ""Private entrance"", ""Private patio or balcony"", ""Free parking on premises"", ""Outdoor furniture"", ""Long term stays allowed"", ""Central air conditioning"", ""Pool table"", ""Hot water kettle"", ""Body soap"", ""Clothing storage: walk-in closet, closet, and wardrobe"", ""55 inch HDTV"", ""Books and reading material"", ""Conditioner"", ""Hair dryer"", ""Cleaning products"", ""Essentials"", ""Bed linens"", ""Iron"", ""Fire extinguisher"", ""Free washer \u2013 In unit"", ""Dishes and silverware"", ""Luggage dropoff allowed"", ""Carbon monoxide alarm"", ""Dedicated workspace"", ""Toaster"", ""Smoke alarm"", ""Free street parking"", ""GE stainless steel electric stove"", ""Board games"", ""Freezer"", ""Coffee maker: french press"", ""Kitchen"", ""Cooking basics"", ""Microwave"", ""Hot water""]",$270.00,32,365,32,32,365,365,32.0,365.0,,t,15,45,75,165,2024-09-17,4,2,0,2023-08-06,2024-05-27,5.0,4.75,4.5,5.0,5.0,5.0,4.75,,f,1,1,0,0,0.29
